{
  "$schema": "https://json-schema.org/draft/2020-12/schema",
  "$id": "topic-overviews.schema.json",
  "title": "Topic overview entry",
  "type": "object",
  "required": [
    "topicId",
    "definition",
    "whatItDoes",
    "tablesInvolved",
    "keyComponents",
    "realTimeExamples",
    "interviewPitfalls"
  ],
  "properties": {
    "topicId": { "type": "string", "minLength": 1 },
    "definition": { "type": "string", "minLength": 1 },
    "whatItDoes": { "type": "string", "minLength": 1 },
    "tablesInvolved": {
      "type": "array",
      "minItems": 1,
      "items": { "type": "string", "minLength": 1 }
    },
    "keyComponents": {
      "type": "array",
      "minItems": 1,
      "items": { "type": "string", "minLength": 1 }
    },
    "realTimeExamples": {
      "type": "array",
      "minItems": 1,
      "items": { "type": "string", "minLength": 1 }
    },
    "interviewPitfalls": {
      "type": "array",
      "minItems": 1,
      "items": { "type": "string", "minLength": 1 }
    }
  },
  "additionalProperties": true
}
