[
  {
    "topicId": "acls",
    "definition": "Access Control rules (ACLs) control whether a user can access a platform object or perform an operation such as read, write, create, delete, or execute.",
    "whatItDoes": "ACLs protect record data, field data, and other platform resources by evaluating required roles, conditions, and scripts before access is granted.",
    "tablesInvolved": ["sys_security_acl", "sys_security_acl_role"],
    "keyComponents": [
      "Type, operation, and name determine what resource the ACL protects.",
      "ACL evaluation can include required roles, a condition builder, and an advanced script.",
      "Record and field access must both evaluate correctly when field security is involved.",
      "Specific rules are evaluated before more generic parent-table or wildcard matches."
    ],
    "realTimeExamples": [
      "Restrict write access to Incident work_notes so only support staff can update it.",
      "Protect a Script Include or UI Page with execute access so only the right role can invoke it."
    ],
    "interviewPitfalls": [
      "Explaining ACLs as only role checks and ignoring conditions and scripts.",
      "Testing only one user path instead of validating both allowed and denied outcomes.",
      "Putting expensive GlideRecord logic in ACL scripts without considering performance."
    ]
  },
  {
    "topicId": "business-rules",
    "definition": "Business Rules are server-side scripts that run when records are queried, inserted, updated, deleted, or displayed.",
    "whatItDoes": "They enforce business logic around database operations, maintain data integrity, trigger follow-on processing, and prepare data for the client when needed.",
    "tablesInvolved": ["sys_script"],
    "keyComponents": [
      "The table defines which record set the rule runs against.",
      "The When setting controls timing such as before, after, async, display, or query.",
      "Conditions narrow when the rule runs and reduce unnecessary execution.",
      "Advanced scripts commonly use current and previous objects plus server-side APIs like GlideRecord and GlideSystem."
    ],
    "realTimeExamples": [
      "Set default values or validate required data before an Incident is inserted.",
      "Create a follow-on task or queue an event after a Change request is updated."
    ],
    "interviewPitfalls": [
      "Confusing Business Rules with client-side behavior on the form.",
      "Using a Business Rule without a condition when the logic only applies to a subset of records.",
      "Causing recursion by updating the same record repeatedly without safeguards."
    ]
  },
  {
    "topicId": "before-business-rules",
    "definition": "A before Business Rule runs before the database operation is committed.",
    "whatItDoes": "It is typically used to validate data or set field values on the current record before insert, update, or delete processing completes.",
    "tablesInvolved": ["sys_script"],
    "keyComponents": [
      "Runs in the transaction before the row is committed.",
      "Can change values on current without requiring a separate update() call.",
      "Best used for validation, normalization, and defaulting logic."
    ],
    "realTimeExamples": [
      "Set priority from impact and urgency before an Incident is saved.",
      "Prevent invalid state changes when mandatory supporting data is missing."
    ],
    "interviewPitfalls": [
      "Calling current.update() inside a before rule and creating recursion risk.",
      "Using a before rule for work that should happen after the save, like noncritical follow-on processing."
    ]
  },
  {
    "topicId": "after-business-rules",
    "definition": "An after Business Rule runs immediately after the database operation completes on the current record.",
    "whatItDoes": "It is typically used when the current record is already saved and related processing should happen next, such as updating dependent records or generating follow-on actions.",
    "tablesInvolved": ["sys_script"],
    "keyComponents": [
      "Runs after the current record operation completes.",
      "Useful for logic that depends on the saved state of the record.",
      "Often used for related-record updates, notifications, or event generation."
    ],
    "realTimeExamples": [
      "Create or update related task records after a parent request changes state.",
      "Queue an event for downstream notification processing after a record update."
    ],
    "interviewPitfalls": [
      "Using after rules for simple field defaulting that should be handled in a before rule.",
      "Putting heavy processing in an after rule when async is more appropriate."
    ]
  },
  {
    "topicId": "async-business-rules",
    "definition": "An async Business Rule runs after the database transaction commits, but the logic is deferred to background processing.",
    "whatItDoes": "It offloads noninteractive server work so the user does not wait for long-running post-save logic.",
    "tablesInvolved": ["sys_script", "sys_trigger"],
    "keyComponents": [
      "Runs after commit instead of blocking the user transaction.",
      "Best for noncritical follow-on work such as integrations or heavier calculations.",
      "Cannot be used when immediate client-visible results are required."
    ],
    "realTimeExamples": [
      "Push a saved record to an external system after commit.",
      "Run nonurgent enrichment or downstream processing after an update."
    ],
    "interviewPitfalls": [
      "Expecting async logic to finish before the user sees the saved record.",
      "Using async when downstream logic must happen synchronously for data correctness."
    ]
  },
  {
    "topicId": "display-business-rules",
    "definition": "A display Business Rule runs when a form is being prepared for display and is commonly used to populate g_scratchpad values for the client.",
    "whatItDoes": "It sends server-derived information to the client before the form renders so client scripts can use it without extra round trips.",
    "tablesInvolved": ["sys_script"],
    "keyComponents": [
      "Runs during record display rather than on save.",
      "Often populates g_scratchpad for client-side consumption.",
      "Useful when the client needs server-only data at form load time."
    ],
    "realTimeExamples": [
      "Populate a scratchpad flag so client logic knows whether the current user can see a custom action.",
      "Send related-record summary data needed by an onLoad client script."
    ],
    "interviewPitfalls": [
      "Using a display rule for database update logic.",
      "Sending too much data to g_scratchpad instead of only what the client needs."
    ]
  },
  {
    "topicId": "query-business-rules",
    "definition": "A query Business Rule runs before a database query executes and can change the query conditions that are applied.",
    "whatItDoes": "It restricts or modifies which records are returned from a query, often as an additional security or visibility control.",
    "tablesInvolved": ["sys_script"],
    "keyComponents": [
      "Runs on query operations rather than insert or update.",
      "Can add query conditions to current before records are returned.",
      "Should be used carefully because it affects all matching queries on the table."
    ],
    "realTimeExamples": [
      "Filter a custom table so users only see records for their assignment group.",
      "Apply a global visibility filter to archived or restricted records."
    ],
    "interviewPitfalls": [
      "Using a query Business Rule where ACLs should be the primary security mechanism.",
      "Adding complex logic that unexpectedly hides records across the platform."
    ]
  },
  {
    "topicId": "current-previous",
    "definition": "In Business Rules, current represents the active record being processed and previous represents the record values before the operation when that context is available.",
    "whatItDoes": "These objects let scripts compare old and new values, detect field changes, and act on the record in context.",
    "tablesInvolved": ["sys_script"],
    "keyComponents": [
      "current is a GlideRecord-like object for the record in flight.",
      "previous is used to compare prior values in synchronous Business Rule contexts.",
      "Methods such as changes() and changesTo() are often used for field-change detection."
    ],
    "realTimeExamples": [
      "Trigger logic only when priority changes from 3 to 1.",
      "Add work notes only when assignment group changes."
    ],
    "interviewPitfalls": [
      "Assuming previous is always available in every execution context.",
      "Comparing string values manually when field change helper methods are available."
    ]
  },
  {
    "topicId": "client-scripts",
    "definition": "Client Scripts are client-side JavaScript that run on forms when they load, change, or submit.",
    "whatItDoes": "They control form behavior such as validating data, changing field states, showing messages, and reacting to user input before the request reaches the server.",
    "tablesInvolved": ["sys_script_client"],
    "keyComponents": [
      "Client Script types include onLoad, onChange, and onSubmit for forms.",
      "They commonly use client APIs like g_form and GlideAjax.",
      "They should focus on form behavior, not server-side database operations."
    ],
    "realTimeExamples": [
      "Make a field mandatory when another field changes to a specific value.",
      "Warn users before submitting a high-priority request without required details."
    ],
    "interviewPitfalls": [
      "Trying to use server-side APIs like GlideRecord directly in client scripts.",
      "Putting too much logic in onLoad scripts and slowing the form down."
    ]
  },
  {
    "topicId": "onload-clientscript",
    "definition": "An onLoad Client Script runs when a form loads before the user interacts with it.",